{"$schema":"https://json-schema.org/draft/2020-12/schema","$id":"provan.session_handoff.v2","type":"object","required":["schema_id","session","implementation_binding","wheel","schema_registry","claim_registry","foundry_run","owner_projection","pattern_library","mode_qualification","execution_available","challenge_available","session13_prerequisites","proof_root","reviewer_receipts","limitations"],"properties":{"schema_id":{"const":"provan.session_handoff.v2"},"session":{"const":12},"implementation_binding":{"type":"object"},"wheel":{"type":"object"},"schema_registry":{"type":"object"},"claim_registry":{"type":"object"},"foundry_run":{"type":"object"},"owner_projection":{"type":"object"},"pattern_library":{"type":"object"},"mode_qualification":{"type":"object"},"execution_available":{"const":false},"challenge_available":{"const":false},"session13_prerequisites":{"type":"array","minItems":1},"proof_root":{"type":"string","pattern":"^sha256:[0-9a-f]{64}$"},"reviewer_receipts":{"type":"array"},"limitations":{"type":"array"}},"additionalProperties":false}
