{"challenge_available":false,"claim_registry":{"path":"artifacts/session12/authority/claim_registry.v1.public.json","sha256":"sha256:d04434fda3ac6687ed6cece05ff9d7a8ece74cb35fab1ccbea8796f1966de55e"},"execution_available":false,"foundry_run":{"path":"artifacts/session12/real_use/final_dogfood/foundry_run_binding.v1.public.json","sha256":"sha256:42ea6a50f3442441c6122473de10047eda7a66c25652cfb031fd08dac9077119"},"implementation_binding":{"challenge_available":false,"claim_registry_digest":"sha256:7f620ac12f7b6a432a6ac99fc206bfc47bbbbd6bfad9797ddb3648888ab8a1b5","deep_maturity":"IMPLEMENTED_UNQUALIFIED","execution_available":false,"extension_api_major":1,"implementation_commit":"7c5580df5e5c9e6632889bc7709f1b52fe04c6e7","implementation_tree":"21b8ee1fc162603efac2e9b65ea0a5267c91fb05","package_version":"0.5.0","published":false,"schema_id":"provan.session12_implementation_binding.v1","schema_registry_digest":"sha256:36bfded069afc8950e4969f4daa4b03cc6d1198cf04984684f4d8e8625a971c0","standard_maturity":"IMPLEMENTED_UNQUALIFIED","wheel_sha256":"sha256:85ddf1e3c5fc9362565395c9a341bc418d58884797531c0918c94befc4caaf30"},"limitations":["PRIVATE_OUTPUTS_NOT_PUBLIC","FRONTIER_PROMPT_BASELINES_NOT_CODING_HARNESS","ARM_B_SINGLE_CALL_INTERNAL_ITERATION","SAME_SOL_MODEL_DOES_NOT_ESTABLISH_PROVIDER_OR_MODEL_FAMILY_INDEPENDENCE","FULL_HARNESS_COMPARISON_SESSION16","RAW_SINGLE_BATCH_MEASUREMENTS_NOT_P50_P95","OWNER_CONFIRMATION_REQUIRED","RUNTIME_EVIDENCE_NOT_ESTABLISHED","SESSION13_NOT_IMPLEMENTED"],"mode_qualification":{"deep":"IMPLEMENTED_UNQUALIFIED","standard":"IMPLEMENTED_UNQUALIFIED"},"owner_projection":{"path":"artifacts/session12/real_use/final_dogfood/foundry_acceptance_projection.v1.public.json","sha256":"sha256:a4257dc25b3c6d7d4ee6e36e3c3d18458590ce0359790d955f5007445f6c648b"},"pattern_library":{"path":"artifacts/session12/public/verification_pattern_library.v1.public.json","sha256":"sha256:8d6344411187d967c91524cd299894f47b0f65e34571ba7ba4246a936717a89b"},"proof_root":"sha256:edb4eeca81ea5285f77323da6ed2d6e6e51c343f6d752d023b1ebc7cbe34ab34","reviewer_receipts":[],"schema_id":"provan.session_handoff.v2","schema_registry":{"path":"artifacts/session12/schema_registry.v1.public.json","sha256":"sha256:6c3373a15d92aa94aaf3730676045802f2ff8cda7314c567fb1ddb38a724c440"},"session":12,"session13_prerequisites":["qualified verifier capability","typed read-only work order","environment and command receipts","owner-confirmed Acceptance Contract","no challenge execution"],"wheel":{"path":"dist/provan_assurance-0.5.0-py3-none-any.whl","sha256":"sha256:85ddf1e3c5fc9362565395c9a341bc418d58884797531c0918c94befc4caaf30"}}
